qid,query
1185869,)what was the immediate impact of the success of the manhattan project?
1185868,"_________ justice is designed to repair the harm to victim, the community and the offender caused by the offender criminal act. question 19 options:"
1183785,elegxo meaning
645590,what does physical medicine do
186154,feeding rice cereal how many times per day
457407,most dependable affordable cars
441383,lithophile definition
683408,what is a flail chest
484187,put yourself on child support in texas
666321,what happens in a wrist sprain
564233,what are rhetorical topics
733739,what is considered early fall
1164798,what causes elevated nitrate levels in aquariums
443797,lyme disease symptoms mood
662502,what forms the epineurium
1184679,an alpha helix is an example of which protein structure?
14562,aggregate demand curve
602162,what county is ackley iowa in
708236,what is adiabatic?
693161,what is a nrr noise reduction rating mean
186617,fibroid symptoms after menopause
573027,what are the requirements for neurologist
1173772,meaning of ..bann..
541973,watts & browning engineers
273090,how long was jack denison dorothy dandridge married
441269,literal define
642237,what does lease to purchase on car mean?
503515,steering define
637443,what does fb mean on a ring
1164796,what causes elevation in ast (sgot)
749988,what is garlic used for
135841,definition of legal term injunctive relief
295446,how many seconds should check for breathing
653051,what does the term bar none mean
410621,is frida kahlo mexican
1164795,what causes everything to taste sugary
598443,what color is venus planet
596451,what class lever is a nutcracker
651441,what does the name halima mean
452286,meds that can cause irregular heartbeat
308543,how much does a ballet dancer make
501778,spousal roth ira contribution after age 70
531029,typical retirement fers
651110,what does the name asia mean
396032,infrax system
705580,what is a virtual interface
658203,what ethnicity is darren criss' mom?
387734,how was the esperanza fire started
655102,what does whistling dixie mean
224712,how does a bump key work
1164793,what causes exhaust hanger to fail
605902,what county is fine ny in
581014,what can cause a metallic smell
535936,vde definition
130335,definition chemical
147535,difference between hep b and c
1164792,what causes extreme swelling in just one leg?
569308,what are the drugs used for moderate sedation
753706,what is hardie plank
627871,what does isf mean fluid do
673608,what is a affidavit of support
510071,syracuse minor league baseball
113839,current fuel price in delhi
1164791,what causes eyelid itching and swelling
1183784,element al
1164790,"what causes feelings of detachment from reality,"
96740,concrete walkway cost per square foot
26666,armistead meaning
490046,ross cameron age
485823,reasons why nuclear power is bad
635632,what does dealer invoice price mean
498612,singular noun definition for kids
85453,causes of back pain in female for a week
605764,what county is exeter nh
748182,what is fms medical term
725274,what is boot screening?
401461,is acre capitalized
641186,what does it mean when the bottom of your foot is really hot
468434,oliguric meaning
31086,average annual snowfall in jersey
742160,what is e. pluribus unum
305154,how much do club set bottles cost?
1164787,what causes film creasing during folding process
688661,what is a lease?
535243,va choice provider phone number
321187,how much is a pint of patron
553140,what all is ferric gluconate used for
88585,causes of swollen ankles and feet
416278,is levaquin an antibiotic
652801,what does the sphinx represent
448861,meaning of obtunded
609117,"what county is marlboro, nj"
686474,what is a health unit coordinator
396120,inherent legal definition
82631,carbs withdrawal signs and symptoms
430171,is turmeric curcumin
422799,is rosemary oil good for back pain?
564701,what are setbacks in zoning
677722,what is a cleric
659630,what files do dvd players read
396846,integrated dna technology
667478,what happens when waves hit a concave surface
165324,does dehydration cause sleep harder
118,(metformin what is it and what does it do?)
531802,unconscious bias definition
457773,most expensive places in the world dublin
1164782,what causes fluid in the ears?
650692,what does the legal term demur mean?
622007,what do architectural drawings show
492528,salt water aquarium salinity
481431,prices for massages
296072,how many species go extinct in an average day
711452,what is an alias name
608452,"what county is lawton, ok"
476121,pluvious definition
170935,does restrictive lung disease cause sleep apnea
212020,how common is the name andrew?
756195,what is human trafficking
321944,how much is does it cost to insure a house
398567,irs continuing education requirements
522059,to_date function
617436,what degree  is ideal flag mount
17008,amnesty define
520990,time hawaii
344949,how to become a class b cdl driver
670628,what includes in nursing general survey
620254,what did the nuremberg trials do explanation
561453,what are mangroves
716682,what is an open system server
448235,meaning of material requisition
696473,what is a prostate rub
476888,population brigham city utah
480096,price clips
511086,team uniform color schemes
1164777,what causes gall bladder infection
173769,does vinegar help poison ivy
427099,is the pill nabumetone a narcotic
508811,symptoms of strep throat for an adult
391495,if i contribute to a roth ira is it taxable
588376,what causes hair to break
1164776,what causes gall bladder infections?
1173770,meaning of a navigate
630360,what does a spider bute sore look like
406188,is china bigger than the united states
617804,what degree sunburn causes blisters
30619,average age of nhl teams
316639,how much does it cost to replace a foundation of a house?
751529,what is glycohemoglobin
486399,redemption cast
116736,defense base act chubb
